{
  "$schema": "https://json-schema.org/draft/2020-12/schema",
  "type": "object",
  "properties": {
    "v": {
      "type": "number",
      "const": 1
    },
    "id": {
      "type": "string",
      "format": "uuid",
      "pattern": "^([0-9a-fA-F]{8}-[0-9a-fA-F]{4}-[1-8][0-9a-fA-F]{3}-[89abAB][0-9a-fA-F]{3}-[0-9a-fA-F]{12}|00000000-0000-0000-0000-000000000000|ffffffff-ffff-ffff-ffff-ffffffffffff)$"
    },
    "task_id": {
      "type": "string",
      "format": "uuid",
      "pattern": "^([0-9a-fA-F]{8}-[0-9a-fA-F]{4}-[1-8][0-9a-fA-F]{3}-[89abAB][0-9a-fA-F]{3}-[0-9a-fA-F]{12}|00000000-0000-0000-0000-000000000000|ffffffff-ffff-ffff-ffff-ffffffffffff)$"
    },
    "in_reply_to": {
      "type": "string",
      "format": "uuid",
      "pattern": "^([0-9a-fA-F]{8}-[0-9a-fA-F]{4}-[1-8][0-9a-fA-F]{3}-[89abAB][0-9a-fA-F]{3}-[0-9a-fA-F]{12}|00000000-0000-0000-0000-000000000000|ffffffff-ffff-ffff-ffff-ffffffffffff)$"
    },
    "from": {
      "type": "string",
      "enum": [
        "concierge",
        "orchestrator",
        "architect",
        "planner",
        "worker",
        "reviewer",
        "librarian"
      ]
    },
    "status": {
      "type": "string",
      "enum": [
        "done",
        "blocked",
        "needs_decision",
        "failed"
      ]
    },
    "summary": {
      "type": "string",
      "minLength": 1,
      "maxLength": 600
    },
    "artifact": {
      "oneOf": [
        {
          "type": "object",
          "properties": {
            "kind": {
              "type": "string",
              "const": "file"
            },
            "repo": {
              "type": "string",
              "pattern": "^[\\w.-]+\\/[\\w.-]+$"
            },
            "path": {
              "type": "string",
              "minLength": 1
            },
            "sha": {
              "type": "string",
              "pattern": "^[0-9a-f]{7,40}$"
            }
          },
          "required": [
            "kind",
            "repo",
            "path"
          ]
        },
        {
          "type": "object",
          "properties": {
            "kind": {
              "type": "string",
              "const": "commit"
            },
            "repo": {
              "type": "string",
              "pattern": "^[\\w.-]+\\/[\\w.-]+$"
            },
            "branch": {
              "type": "string",
              "minLength": 1
            },
            "sha": {
              "type": "string",
              "pattern": "^[0-9a-f]{40}$"
            }
          },
          "required": [
            "kind",
            "repo",
            "branch",
            "sha"
          ]
        },
        {
          "type": "object",
          "properties": {
            "kind": {
              "type": "string",
              "const": "context"
            },
            "path": {
              "type": "string",
              "minLength": 1
            }
          },
          "required": [
            "kind",
            "path"
          ]
        },
        {
          "type": "object",
          "properties": {
            "kind": {
              "type": "string",
              "const": "decision"
            },
            "id": {
              "type": "string",
              "pattern": "^D-\\d{4,}$"
            }
          },
          "required": [
            "kind",
            "id"
          ]
        },
        {
          "type": "object",
          "properties": {
            "kind": {
              "type": "string",
              "const": "task"
            },
            "id": {
              "type": "string",
              "format": "uuid",
              "pattern": "^([0-9a-fA-F]{8}-[0-9a-fA-F]{4}-[1-8][0-9a-fA-F]{3}-[89abAB][0-9a-fA-F]{3}-[0-9a-fA-F]{12}|00000000-0000-0000-0000-000000000000|ffffffff-ffff-ffff-ffff-ffffffffffff)$"
            }
          },
          "required": [
            "kind",
            "id"
          ]
        },
        {
          "type": "object",
          "properties": {
            "kind": {
              "type": "string",
              "const": "run"
            },
            "id": {
              "type": "string",
              "format": "uuid",
              "pattern": "^([0-9a-fA-F]{8}-[0-9a-fA-F]{4}-[1-8][0-9a-fA-F]{3}-[89abAB][0-9a-fA-F]{3}-[0-9a-fA-F]{12}|00000000-0000-0000-0000-000000000000|ffffffff-ffff-ffff-ffff-ffffffffffff)$"
            }
          },
          "required": [
            "kind",
            "id"
          ]
        },
        {
          "type": "object",
          "properties": {
            "kind": {
              "type": "string",
              "const": "pr"
            },
            "repo": {
              "type": "string",
              "pattern": "^[\\w.-]+\\/[\\w.-]+$"
            },
            "number": {
              "type": "integer",
              "exclusiveMinimum": 0,
              "maximum": 9007199254740991
            }
          },
          "required": [
            "kind",
            "repo",
            "number"
          ]
        },
        {
          "type": "object",
          "properties": {
            "kind": {
              "type": "string",
              "const": "thread"
            },
            "provider": {
              "type": "string",
              "enum": [
                "slack",
                "github",
                "cli"
              ]
            },
            "id": {
              "type": "string",
              "minLength": 1
            }
          },
          "required": [
            "kind",
            "provider",
            "id"
          ]
        },
        {
          "type": "object",
          "properties": {
            "kind": {
              "type": "string",
              "const": "transcript"
            },
            "uri": {
              "type": "string",
              "minLength": 1
            }
          },
          "required": [
            "kind",
            "uri"
          ]
        },
        {
          "type": "object",
          "properties": {
            "kind": {
              "type": "string",
              "const": "url"
            },
            "url": {
              "type": "string",
              "format": "uri"
            }
          },
          "required": [
            "kind",
            "url"
          ]
        }
      ]
    },
    "question": {
      "type": "object",
      "properties": {
        "kind": {
          "type": "string",
          "enum": [
            "technical",
            "business"
          ]
        },
        "text": {
          "type": "string",
          "minLength": 1,
          "maxLength": 1000
        },
        "options": {
          "minItems": 2,
          "maxItems": 6,
          "type": "array",
          "items": {
            "type": "string",
            "minLength": 1,
            "maxLength": 200
          }
        },
        "refs": {
          "default": [],
          "maxItems": 20,
          "type": "array",
          "items": {
            "oneOf": [
              {
                "type": "object",
                "properties": {
                  "kind": {
                    "type": "string",
                    "const": "file"
                  },
                  "repo": {
                    "type": "string",
                    "pattern": "^[\\w.-]+\\/[\\w.-]+$"
                  },
                  "path": {
                    "type": "string",
                    "minLength": 1
                  },
                  "sha": {
                    "type": "string",
                    "pattern": "^[0-9a-f]{7,40}$"
                  }
                },
                "required": [
                  "kind",
                  "repo",
                  "path"
                ]
              },
              {
                "type": "object",
                "properties": {
                  "kind": {
                    "type": "string",
                    "const": "commit"
                  },
                  "repo": {
                    "type": "string",
                    "pattern": "^[\\w.-]+\\/[\\w.-]+$"
                  },
                  "branch": {
                    "type": "string",
                    "minLength": 1
                  },
                  "sha": {
                    "type": "string",
                    "pattern": "^[0-9a-f]{40}$"
                  }
                },
                "required": [
                  "kind",
                  "repo",
                  "branch",
                  "sha"
                ]
              },
              {
                "type": "object",
                "properties": {
                  "kind": {
                    "type": "string",
                    "const": "context"
                  },
                  "path": {
                    "type": "string",
                    "minLength": 1
                  }
                },
                "required": [
                  "kind",
                  "path"
                ]
              },
              {
                "type": "object",
                "properties": {
                  "kind": {
                    "type": "string",
                    "const": "decision"
                  },
                  "id": {
                    "type": "string",
                    "pattern": "^D-\\d{4,}$"
                  }
                },
                "required": [
                  "kind",
                  "id"
                ]
              },
              {
                "type": "object",
                "properties": {
                  "kind": {
                    "type": "string",
                    "const": "task"
                  },
                  "id": {
                    "type": "string",
                    "format": "uuid",
                    "pattern": "^([0-9a-fA-F]{8}-[0-9a-fA-F]{4}-[1-8][0-9a-fA-F]{3}-[89abAB][0-9a-fA-F]{3}-[0-9a-fA-F]{12}|00000000-0000-0000-0000-000000000000|ffffffff-ffff-ffff-ffff-ffffffffffff)$"
                  }
                },
                "required": [
                  "kind",
                  "id"
                ]
              },
              {
                "type": "object",
                "properties": {
                  "kind": {
                    "type": "string",
                    "const": "run"
                  },
                  "id": {
                    "type": "string",
                    "format": "uuid",
                    "pattern": "^([0-9a-fA-F]{8}-[0-9a-fA-F]{4}-[1-8][0-9a-fA-F]{3}-[89abAB][0-9a-fA-F]{3}-[0-9a-fA-F]{12}|00000000-0000-0000-0000-000000000000|ffffffff-ffff-ffff-ffff-ffffffffffff)$"
                  }
                },
                "required": [
                  "kind",
                  "id"
                ]
              },
              {
                "type": "object",
                "properties": {
                  "kind": {
                    "type": "string",
                    "const": "pr"
                  },
                  "repo": {
                    "type": "string",
                    "pattern": "^[\\w.-]+\\/[\\w.-]+$"
                  },
                  "number": {
                    "type": "integer",
                    "exclusiveMinimum": 0,
                    "maximum": 9007199254740991
                  }
                },
                "required": [
                  "kind",
                  "repo",
                  "number"
                ]
              },
              {
                "type": "object",
                "properties": {
                  "kind": {
                    "type": "string",
                    "const": "thread"
                  },
                  "provider": {
                    "type": "string",
                    "enum": [
                      "slack",
                      "github",
                      "cli"
                    ]
                  },
                  "id": {
                    "type": "string",
                    "minLength": 1
                  }
                },
                "required": [
                  "kind",
                  "provider",
                  "id"
                ]
              },
              {
                "type": "object",
                "properties": {
                  "kind": {
                    "type": "string",
                    "const": "transcript"
                  },
                  "uri": {
                    "type": "string",
                    "minLength": 1
                  }
                },
                "required": [
                  "kind",
                  "uri"
                ]
              },
              {
                "type": "object",
                "properties": {
                  "kind": {
                    "type": "string",
                    "const": "url"
                  },
                  "url": {
                    "type": "string",
                    "format": "uri"
                  }
                },
                "required": [
                  "kind",
                  "url"
                ]
              }
            ]
          }
        }
      },
      "required": [
        "kind",
        "text"
      ]
    },
    "blocked_by": {
      "type": "array",
      "items": {
        "type": "string",
        "format": "uuid",
        "pattern": "^([0-9a-fA-F]{8}-[0-9a-fA-F]{4}-[1-8][0-9a-fA-F]{3}-[89abAB][0-9a-fA-F]{3}-[0-9a-fA-F]{12}|00000000-0000-0000-0000-000000000000|ffffffff-ffff-ffff-ffff-ffffffffffff)$"
      }
    }
  },
  "required": [
    "v",
    "id",
    "task_id",
    "in_reply_to",
    "from",
    "status",
    "summary"
  ]
}
